Date Last Researched,Country/Area,Project Name,Unit Name,Project Name in Local Language / Script,Other Name(s),Capacity (MW),Technology,Status,Status Details,Latest Activity,Start year,Retired year,Operator,Operator Name in Local Language / Script,Owner,Owner Name in Local Language / Script,Employment Notes,Hydrogen,Latitude,Longitude,Location accuracy,City,"Local area (taluk, county)","Major area (prefecture, district)",State/Province,Subregion,Region,Other IDs (location),Other IDs (unit/phase),GEM location ID,GEM unit ID,Wiki URL
1.5.2023,El Salvador,Ahuachapán geothermal power plant,3,Central geotérmica Ahuachapán,,35,flash steam - single,operating,,,1980,,LaGeo,,LaGeo [100%],,,,13.9202,-89.8174,exact,Ahuachapan,Municipio de Ahuachapán,,Departamento de Ahuachapán,Latin America and the Caribbean,Americas,World Resources Institute: GEODB0043615,,L100000700001,G100000700003,https://gem.wiki/Ahuachapán_geothermal_power_plant
1.5.2023,El Salvador,Ahuachapán geothermal power plant,1,Central geotérmica Ahuachapán,,30,flash steam - single,operating,,,1975,,LaGeo,,LaGeo [100%],,,,13.9202,-89.8174,exact,Ahuachapan,Municipio de Ahuachapán,,Departamento de Ahuachapán,Latin America and the Caribbean,Americas,World Resources Institute: GEODB0043615,,L100000700001,G100000700001,https://gem.wiki/Ahuachapán_geothermal_power_plant
1.5.2023,El Salvador,Ahuachapán geothermal power plant,2,Central geotérmica Ahuachapán,,30,flash steam - single,operating,,,1976,,LaGeo,,LaGeo [100%],,,,13.9202,-89.8174,exact,Ahuachapan,Municipio de Ahuachapán,,Departamento de Ahuachapán,Latin America and the Caribbean,Americas,World Resources Institute: GEODB0043615,,L100000700001,G100000700002,https://gem.wiki/Ahuachapán_geothermal_power_plant
12.3.2024,Kenya,Akiira One geothermal power plant,1,,,70,binary cycle,pre-construction,,,2025,,Akiira Geothermal LTD,,Frontier Energy [100%],,,,-0.3024,36.0805,approximate,,,,Nakuru,Sub-Saharan Africa,Africa,,,L100000700002,G100000700004,https://gem.wiki/Akiira_One_geothermal_power_plant
12.3.2024,Kenya,Akiira One geothermal power plant,2,,,70,binary cycle,pre-construction,,,2025,,Akiira Geothermal LTD,,Frontier Energy [100%],,,,-0.3024,36.0805,approximate,,,,Nakuru,Sub-Saharan Africa,Africa,,,L100000700002,G100000700005,https://gem.wiki/Akiira_One_geothermal_power_plant
4.5.2023,Türkiye,Alaşehir 1 geothermal power plant,1,,,45,flash steam - double,operating,,,2015,,Zorlu Enerji,,Zorlu Enerji [100%],,,,38.4002,28.4311,exact,Manisa,Alaşehir,,,Western Asia,Asia,World Resources Institute: WRI1018958,,L100000700003,G100000700007,https://gem.wiki/Alaşehir_1_geothermal_power_plant
14.3.2024,Türkiye,Alaşehir 3 geothermal power plant,--,,,50,unknown type,pre-construction,,,,,,,Zorlu Enerji [100%],,,,38.4002,28.4311,approximate,,,Alaşehir,Manisa,Western Asia,Asia,,,L100000700242,G100000700432,https://gem.wiki/Alaşehir_3_geothermal_power_plant
13.3.2024,Ethiopia,Aluto Langano geothermal power plant,1,,,35,unknown type,construction,,,,,Ethiopian Electric Power (EEP),,Ethiopian Electric Power (EEP) [100%],,,,7.7888,38.7952,exact,,,Arsi,Oromia Region,Sub-Saharan Africa,Africa,,,L100000700004,G100000700008,https://gem.wiki/Aluto_Langano_geothermal_power_plant
13.3.2024,Ethiopia,Aluto Langano geothermal power plant,2,,,35,unknown type,construction,,,,,Ethiopian Electric Power (EEP),,Ethiopian Electric Power (EEP) [100%],,,,7.7888,38.7952,exact,,,Arsi,Oromia Region,Sub-Saharan Africa,Africa,,,L100000700004,G100001005193,https://gem.wiki/Aluto_Langano_geothermal_power_plant
13.3.2024,Philippines,Amacan geothermal power plant,--,,,50,unknown type,pre-construction,,,,,,,Energy Development CORP (EDC) [100%],,,,7.5113,125.9569,approximate,,Mawab,,Davao de Oro,South-eastern Asia,Asia,,,L100000700225,G100000700406,https://gem.wiki/Amacan_geothermal_power_plant
9.5.2023,Indonesia,Arrow Lampung geothermal power plant,--,,,50,unknown type,cancelled - inferred 4 y,,,,,Arrow Resources Development,,Arrow Resources Development [100%],,,,-4.5846,105.3231,approximate,,,,Lampung,South-eastern Asia,Asia,,,L100000700005,G100000700009,https://gem.wiki/Arrow_Lampung_geothermal_power_plant
3.5.2023,Philippines,Bac-Man geothermal power plant,Bacon-Manito 1.1,,,55,flash steam - single,operating,,,1993,,Energy Development CORP (EDC),,Energy Development CORP (EDC) [100%],,,,13.0547,123.9678,exact,Sorsogon City,,,Sorsogon,South-eastern Asia,Asia,World Resources Institute: WRI1001889,,L100000700006,G100000700010,https://gem.wiki/Bac-Man_geothermal_power_plant
3.5.2023,Philippines,Bac-Man geothermal power plant,Bacon-Manito 1.2,,,55,flash steam - single,operating,,,1993,,Energy Development CORP (EDC),,Energy Development CORP (EDC) [100%],,,,13.0547,123.9678,exact,Sorsogon City,,,Sorsogon,South-eastern Asia,Asia,World Resources Institute: WRI1001889,,L100000700006,G100000700011,https://gem.wiki/Bac-Man_geothermal_power_plant
2.5.2023,Italy,Bagnore geothermal power plant,4,Centrale geotermica Bagnore,,40,dry steam,operating,,,2014,,Enel Green Power,,Enel Green Power [100%],,,,42.8416,11.5588,exact,,Grosseto,,Tuscany,Southern Europe,Europe,World Resources Institute: WRI1021456,,L100000700007,G100000700012,https://gem.wiki/Bagnore_geothermal_power_plant
13.3.2024,Indonesia,Banten geothermal power plant,--,,Banten Prospect,110,unknown type,pre-construction,,,,,PT Sintesa Green Energy,,PT Sintesa Green Energy [100%],,,,-6.326,106.1161,approximate,,Pandeglang,Pandeglang Regency,Banten,South-eastern Asia,Asia,,,L100000700008,G100000700013,https://gem.wiki/Banten_geothermal_power_plant
12.3.2024,Kenya,Baringo-Silali geothermal power plant,Korosi,,,100,unknown type,pre-construction,,,,,Geothermal Development Company (GDC),,Geothermal Development Company (GDC) [100%],,,,1.1689,36.1726,approximate,,Mount Silali,,Baringo Province,Sub-Saharan Africa,Africa,,,L100000700009,G100000700015,https://gem.wiki/Baringo-Silali_geothermal_power_plant
12.3.2024,Kenya,Baringo-Silali geothermal power plant,Paka,,,100,unknown type,pre-construction,,,,,Geothermal Development Company (GDC),,Geothermal Development Company (GDC) [100%],,,,1.1689,36.1726,approximate,,Mount Silali,,Baringo Province,Sub-Saharan Africa,Africa,,,L100000700009,G100000700014,https://gem.wiki/Baringo-Silali_geothermal_power_plant
12.3.2024,Kenya,Baringo-Silali geothermal power plant,Silali,,,100,unknown type,pre-construction,,,,,Geothermal Development Company (GDC),,Geothermal Development Company (GDC) [100%],,,,1.1689,36.1726,approximate,,Mount Silali,,Baringo Province,Sub-Saharan Africa,Africa,,,L100000700009,G100000700016,https://gem.wiki/Baringo-Silali_geothermal_power_plant
13.3.2024,Indonesia,Baturaden geothermal power plant,Future units,,"Baturaden-Slamet, Wkp Baturraden",170,unknown type,pre-construction,,,2025,,,,PT Trinergy Mandiri International [11%]; PT Nirwana Suci Abadi [89%],,,,-7.3001,109.2168,approximate,,,,Central Java,South-eastern Asia,Asia,,,L100000700199,G100000700343,https://gem.wiki/Baturaden_geothermal_power_plant
13.3.2024,Indonesia,Baturaden geothermal power plant,1,,"Baturaden-Slamet, Wkp Baturraden",50,unknown type,construction,,,,,,,PT Trinergy Mandiri International [11%]; PT Nirwana Suci Abadi [89%],,,,-7.3001,109.2168,approximate,,,,Central Java,South-eastern Asia,Asia,,,L100000700199,G100000700342,https://gem.wiki/Baturaden_geothermal_power_plant
13.3.2024,Philippines,Baua-Sikaw geothermal power plant,--,,,61,unknown type,pre-construction,,,,,,,Pan Pacific Power Phillippines CORP [100%],,,,18.3822,122.1445,approximate,,Santa Ana,,Cagayan,South-eastern Asia,Asia,,,L100000700226,G100000700409,https://gem.wiki/Baua-Sikaw_geothermal_power_plant
1.5.2023,El Salvador,Berlín geothermal power plant,--,Central geotérmica Berlín,,40,flash steam - single,operating,,,2007,,LaGeo,,LaGeo [100%],,,,13.5248,-88.5073,exact,Berlín,,,Departamento de Usulután,Latin America and the Caribbean,Americas,World Resources Institute: GEODB0043616,,L100000700010,G100000700017,https://gem.wiki/Berlín_geothermal_power_plant
3.5.2023,United States,Big Geysers geothermal plant,13,,Geysers geothermal plant U13,138,dry steam,operating,,,1980,,Geysers Power Co LLC,,Calpine CORP [100%],,,,38.777,-122.745,exact,,Sonoma County,,California,Northern America,Americas,"EIA: 286, World Resources Institute: USA0000286",,L100000700011,G100000700018,https://gem.wiki/Big_Geysers_geothermal_plant
13.3.2024,Philippines,Biliran geothermal power plant,--,,,50,unknown type,pre-construction,,,2025,,,,Biliran Geothermal INC [100%],,,,11.5993,124.4839,approximate,,Naval,,Biliran,South-eastern Asia,Asia,,,L100000700227,G100000700410,https://gem.wiki/Biliran_geothermal_power_plant
2.5.2023,Iceland,Bitra geothermal power plant,--,,,135,unknown type,cancelled - inferred 4 y,,,,,Orkuveita Reykjavikur,,Orkuveita Reykjavikur [100%],,,,63.8576,-21.3844,approximate,,,Ölfus,Southern Region,Northern Europe,Europe,,,L100000700012,G100000700019,https://gem.wiki/Bitra_geothermal_power_plant
2.5.2023,Iceland,Bjarnarflag geothermal power plant,1,,,45,unknown type,cancelled - inferred 4 y,,,,,Landsvirkjun,,Landsvirkjun [100%],,,,65.6432,-16.8462,exact,,Þingeyjarsveit,Northeastern Region,,Northern Europe,Europe,,,L100000700013,G100000700020,https://gem.wiki/Bjarnarflag_geothermal_power_plant
2.5.2023,Iceland,Bjarnarflag geothermal power plant,2,,,45,unknown type,cancelled - inferred 4 y,,,,,Landsvirkjun,,Landsvirkjun [100%],,,,65.6432,-16.8462,exact,,Þingeyjarsveit,Northeastern Region,,Northern Europe,Europe,,,L100000700013,G100000700021,https://gem.wiki/Bjarnarflag_geothermal_power_plant
1.4.2024,United States,Black Rock geothermal power plant,--,,Black Rock Geothermal Project (BRGP),77,,pre-construction,,,,,,,Black Rock Geothermal LLC,,,,33.1493115,-115.6278498,approximate,,Imperial County,,California,Northern America,Americas,,,L100001004552,G100001005340,https://www.gem.wiki/Black_Rock_geothermal_power_plant
13.3.2024,Indonesia,Blawan Ijen geothermal project,2,,,55,unknown type,pre-construction,,,,,PT Medco Power Indonesia,,PT Medco Power Indonesia [51%]; Ormat Technology INC [49%],,,,-7.9735,114.1708,approximate,,,Blawan Ijen,East Java,South-eastern Asia,Asia,,,L100000700014,G100000700023,https://gem.wiki/Blawan_Ijen_geothermal_project
13.3.2024,Indonesia,Blawan Ijen geothermal project,1,,,34,unknown type,construction,,,2025,,PT Medco Power Indonesia,,PT Medco Power Indonesia [51%]; Ormat Technology INC [49%],,,,-7.9768,114.1883,approximate,,,Blawan Ijen,East Java,South-eastern Asia,Asia,,,L100000700014,G100000700022,https://gem.wiki/Blawan_Ijen_geothermal_project
3.5.2023,United States,Blue Mountain geothermal plant,--,,"Faulkner I, NGP Blue Mountain",50,binary cycle,operating,,,2010,,,,AltaRock Energy [100%],,,,40.9952,-118.142,exact,,Humboldt County,,Nevada,Northern America,Americas,"EIA: 56982, World Resources Institute: USA0056982",,L100000700015,G100000700024,https://gem.wiki/Blue_Mountain_geothermal_plant
3.5.2023,United States,Blundell 1 geothermal plant,--,,,31,flash steam - unknown,operating,,,1984,,PacifiCorp,,PacifiCorp [100%],,,,38.4889,-112.8533,exact,,Beaver County,,Utah,Northern America,Americas,"EIA: 299, World Resources Institute: USA0000299",,L100000700016,G100000700025,https://gem.wiki/Blundell_1_geothermal_plant
15.5.2023,United States,Blundell 3 geothermal plant,--,,,30,unknown type,cancelled,,,,,PacifiCorp,,PacifiCorp [100%],,,,38.4889,-112.8533,exact,,Beaver County,,Utah,Northern America,Americas,EIA: 299,,L100000700017,G100000700026,https://gem.wiki/Blundell_3_geothermal_plant
13.3.2024,Costa Rica,Borinquen geothermal power project,1,Central geotérmica Borinquen,,55,unknown type,construction,,,2027,,Costa Rican Electricity Institute (ICE),,Costa Rican Electricity Institute (ICE) [100%],,,,10.6344,-85.4397,approximate,,,Liberia,Guanacaste,Latin America and the Caribbean,Americas,,,L100000700018,G100000700027,https://gem.wiki/Borinquen_geothermal_power_project
13.3.2024,Costa Rica,Borinquen geothermal power project,2,Central geotérmica Borinquen,,55,unknown type,pre-construction,,,2027,,Costa Rican Electricity Institute (ICE),,Costa Rican Electricity Institute (ICE) [100%],,,,10.6344,-85.4397,approximate,,,Liberia,Guanacaste,Latin America and the Caribbean,Americas,,,L100000700018,G100000700028,https://gem.wiki/Borinquen_geothermal_power_project
3.5.2023,United States,Bottle Rock Power geothermal plant,--,,,55,flash steam - single,operating,,,1985,,Bottle Rock Power LLC,,Baseload Clean Energy Partners [100%],,,,38.8348,-122.7677,exact,,Lake County,,California,Northern America,Americas,"EIA: 902, World Resources Institute: USA0000902",,L100000700019,G100000700029,https://gem.wiki/Bottle_Rock_Power_geothermal_plant
13.3.2024,Uganda,Buranga geothermal power plant,--,,,100,unknown type,pre-construction,,,2025,,Gids Consult LTD,,Gids Consult Ltd [100%],,,,0.8332,30.1664,approximate,,,,Mongiro,Sub-Saharan Africa,Africa,,,L100000700021,G100000700031,https://gem.wiki/Buranga_geothermal_power_plant
13.3.2024,Peru,Cabanaconde geothermal power plant,--,Central geotérmica Cabanaconde,,100,unknown type,pre-construction,,,2027,,Energy Development CORP (EDC),,Energy Development CORP (EDC) [100%],,,,-15.622,-71.9798,approximate,,Cabanaconde,Caylloma,Arequipa,Latin America and the Caribbean,Americas,,,L100000700022,G100000700032,https://gem.wiki/Cabanaconde_geothermal_power_plant
13.3.2024,Philippines,Cagua-Baua geothermal power plant,--,,,45,unknown type,pre-construction,,,,,,,Pan Pacific Power Phillippines CORP [100%],,,,18.3822,122.1445,approximate,,Santa Ana,,Cagayan,South-eastern Asia,Asia,,,L100000700228,G100000700411,https://gem.wiki/Cagua-Baua_geothermal_power_plant
3.5.2023,United States,Calistoga geothermal plant,1,,Geysers geothermal plant U19 (Phase 2),88,dry steam,operating,,,1984,,Geysers Power Co LLC,,Geysers Power Co LLC [100%],,,,38.7879,-122.7434,exact,,Lake County,,California,Northern America,Americas,"EIA: 50066, World Resources Institute: USA0050066",,L100000700023,G100000700034,https://gem.wiki/Calistoga_geothermal_plant
3.5.2023,United States,Calistoga geothermal plant,2,,Geysers geothermal plant U19 (Phase 2),88,dry steam,operating,,,1984,,Geysers Power Co LLC,,Geysers Power Co LLC [100%],,,,38.7894,-122.7455,exact,,Lake County,,California,Northern America,Americas,"EIA: 50066, World Resources Institute: USA0050066",,L100000700023,G100000700033,https://gem.wiki/Calistoga_geothermal_plant
1.4.2024,United States,Cape Station geothermal power plant,future units,,,300,EGS,pre-construction,Drilling at Cape Station began in June 2023.,,2028,,Fervo Energy,,Fervo Energy,,"""The first two phases of Cape Station are expected to create approximately 6,602 temporary jobs during construction and 161 full-time operational jobs, resulting in more than $437 million in earned wages. Fervo is committed to sourcing jobs from the local labor pool when possible.""",,38.4693866,-112.9276109,approximate,,Beaver County,,Utah,Northern America,Americas,,,L100001004553,G100001005342,https://www.gem.wiki/Cape_Station_geothermal_power_plant
1.4.2024,United States,Cape Station geothermal power plant,1,,,100,EGS,construction,Drilling at Cape Station began in June 2023.,,2026,,Fervo Energy,,Fervo Energy,,"""The first two phases of Cape Station are expected to create approximately 6,602 temporary jobs during construction and 161 full-time operational jobs, resulting in more than $437 million in earned wages. Fervo is committed to sourcing jobs from the local labor pool when possible.""",,38.4693866,-112.9276109,approximate,,Beaver County,,Utah,Northern America,Americas,,,L100001004553,G100001005341,https://www.gem.wiki/Cape_Station_geothermal_power_plant
11.5.2023,United States,Casa Diablo 4 geothermal power plant,--,,Mammoth Complex,30,binary cycle,operating,,,2022,,Ormat Technology INC,,Ormat Technology INC [100%],,,,37.6449,-118.9149,exact,,Mono County,,California,Northern America,Americas,EIA: 63490,,L100000700258,G100000700471,https://gem.wiki/Casa_Diablo_4_geothermal_power_plant
2.5.2023,Nicaragua,Casita - San Cristóbal geothermal power plant,--,Central geotérmica Casita - San Cristóbal,Casita geothermal project,35,unknown type,cancelled - inferred 4 y,,,,,Empresa Nicaragüense de Electricidad (ENEL),,Empresa Nicaragüense de Electricidad (ENEL) [50%]; Polaris Energy Nicaragua [50%],,,,12.7231,-87.0836,approximate,,,San Cristóbal,Chinadega,Latin America and the Caribbean,Americas,,,L100000700024,G100000700035,https://gem.wiki/Casita_-_San_Cristóbal_geothermal_power_plant
3.5.2023,United States,CE Leathers geothermal plant,1,,Leathers geothermal facility,46,flash steam - double,operating,,,1989,,CalEnergy Operating CORP,,CalEnergy Operating CORP [100%],,,,33.1779,-115.565,exact,,Imperial County,,California,Northern America,Americas,"EIA: 10631, World Resources Institute: USA0010631",,L100000700025,G100000700036,https://gem.wiki/CE_Leathers_geothermal_plant
1.5.2023,Chile,Cerro Pabellón geothermal power plant,3,Central geotérmica Cerro Pabellón,,33,binary cycle,operating,,,2021,,Geotérmica Del Norte (GDN),,Empresa Nacional del Petróleo [50%]; Enel Chile [50%],,,,-21.8576,-68.1515,exact,Ollagüe,Provincia de El Loa,,Antofagasta Region,Latin America and the Caribbean,Americas,,,L100000700026,G100000700037,https://gem.wiki/Cerro_Pabellón_geothermal_power_plant
2.5.2023,Mexico,Cerro Prieto 1 geothermal power plant,1,Central geotérmica Cerro Prieto 1,,38,flash steam - single,retired,,,1973,2016,Comision Federal De Electricidad,,Comision Federal De Electricidad [100%],,,,32.3985,-115.2379,exact,,Municipio de Mexicali,,Baja California,Latin America and the Caribbean,Americas,World Resources Institute: MEX0006611,,L100000700027,G100000700038,https://gem.wiki/Cerro_Prieto_1_geothermal_power_plant
2.5.2023,Mexico,Cerro Prieto 1 geothermal power plant,2,Central geotérmica Cerro Prieto 1,,38,flash steam - single,retired,,,1973,2016,Comision Federal De Electricidad,,Comision Federal De Electricidad [100%],,,,32.3985,-115.2379,exact,,Municipio de Mexicali,,Baja California,Latin America and the Caribbean,Americas,World Resources Institute: MEX0006611,,L100000700027,G100000700039,https://gem.wiki/Cerro_Prieto_1_geothermal_power_plant
2.5.2023,Mexico,Cerro Prieto 1 geothermal power plant,3,Central geotérmica Cerro Prieto 1,,38,flash steam - single,retired,,,1979,2016,Comision Federal De Electricidad,,Comision Federal De Electricidad [100%],,,,32.3985,-115.2379,exact,,Municipio de Mexicali,,Baja California,Latin America and the Caribbean,Americas,World Resources Institute: MEX0006611,,L100000700027,G100000700040,https://gem.wiki/Cerro_Prieto_1_geothermal_power_plant
2.5.2023,Mexico,Cerro Prieto 1 geothermal power plant,4,Central geotérmica Cerro Prieto 1,,38,flash steam - single,retired,,,1979,2016,Comision Federal De Electricidad,,Comision Federal De Electricidad [100%],,,,32.3985,-115.2379,exact,,Municipio de Mexicali,,Baja California,Latin America and the Caribbean,Americas,World Resources Institute: MEX0006611,,L100000700027,G100000700041,https://gem.wiki/Cerro_Prieto_1_geothermal_power_plant
2.5.2023,Mexico,Cerro Prieto 1 geothermal power plant,5,Central geotérmica Cerro Prieto 1,,30,flash steam - single,operating,,,1982,,Comision Federal De Electricidad,,Comision Federal De Electricidad [100%],,,,32.3985,-115.2379,exact,,Municipio de Mexicali,,Baja California,Latin America and the Caribbean,Americas,World Resources Institute: MEX0006611,,L100000700027,G100000700042,https://gem.wiki/Cerro_Prieto_1_geothermal_power_plant
2.5.2023,Mexico,Cerro Prieto 2 geothermal power plant,6,Central geotérmica Cerro Prieto 2,,110,flash steam - double,operating,,,1986,,Comision Federal De Electricidad,,Comision Federal De Electricidad [100%],,,,32.4047,-115.2113,exact,,Municipio de Mexicali,,Baja California,Latin America and the Caribbean,Americas,World Resources Institute: MEX0001868,,L100000700028,G100000700043,https://gem.wiki/Cerro_Prieto_2_geothermal_power_plant
2.5.2023,Mexico,Cerro Prieto 2 geothermal power plant,7,Central geotérmica Cerro Prieto 2,,110,flash steam - double,operating,,,1987,,Comision Federal De Electricidad,,Comision Federal De Electricidad [100%],,,,32.4047,-115.2113,exact,,Municipio de Mexicali,,Baja California,Latin America and the Caribbean,Americas,World Resources Institute: MEX0001868,,L100000700028,G100000700044,https://gem.wiki/Cerro_Prieto_2_geothermal_power_plant
2.5.2023,Mexico,Cerro Prieto 3 geothermal power plant,8,Central geotérmica Cerro Prieto 3,,110,flash steam - double,operating,,,1986,,Comision Federal De Electricidad,,Comision Federal De Electricidad,,,,32.4126,-115.2433,exact,,Municipio de Mexicali,,Baja California,Latin America and the Caribbean,Americas,World Resources Institute: MEX0001868,,L100000700029,G100000700045,https://gem.wiki/Cerro_Prieto_3_geothermal_power_plant
2.5.2023,Mexico,Cerro Prieto 3 geothermal power plant,9,Central geotérmica Cerro Prieto 3,,110,flash steam - double,operating,,,1987,,Comision Federal De Electricidad,,Comision Federal De Electricidad,,,,32.4126,-115.2433,exact,,Municipio de Mexicali,,Baja California,Latin America and the Caribbean,Americas,World Resources Institute: MEX0001868,,L100000700029,G100000700046,https://gem.wiki/Cerro_Prieto_3_geothermal_power_plant
9.4.2024,Mexico,Cerro Prieto 5 geothermal power plant,10,Central geotérmica Cerro Prieto 5,,50,flash steam - double,operating,,,2012,,Comision Federal De Electricidad,,Comision Federal De Electricidad,,,,32.3916937,-115.2691486,exact,,,Ejido Hidalgo,Baja California,Latin America and the Caribbean,Americas,,,L100000700030,G100000700047,https://gem.wiki/Cerro_Prieto_5_geothermal_power_plant
9.4.2024,Mexico,Cerro Prieto 5 geothermal power plant,11,Central geotérmica Cerro Prieto 5,,50,flash steam - double,operating,,,2012,,Comision Federal De Electricidad,,Comision Federal De Electricidad,,,,32.3916937,-115.2691486,exact,,,Ejido Hidalgo,Baja California,Latin America and the Caribbean,Americas,,,L100000700030,G100000700048,https://gem.wiki/Cerro_Prieto_5_geothermal_power_plant
13.3.2024,Ecuador,Chachimbiro geothermal power plant,--,Proyecto geotérmico Chachimbiro,,50,unknown type,pre-construction,,,2026,,Corporación Eléctrica del Ecuador (CELEC EP),,Corporación Eléctrica del Ecuador (CELEC EP) [100%],,,,0.4599,-78.2364,approximate,,,Imbabura,Urcuquí,Latin America and the Caribbean,Americas,,,L100000700031,G100000700049,https://gem.wiki/Chachimbiro_geothermal_power_plant
13.3.2024,United States,Churchill Valley geothermal power plant,--,,Fervo Churchill Valley,115,unknown type,shelved,,,,,,,East Bay Community Energy (EBCE) [100%],,,,39.5322,-118.2545,approximate,,Churchill County,,Nevada,Northern America,Americas,,,L100000700260,G100000700473,https://gem.wiki/Churchill_Valley_geothermal_power_plant
3.5.2023,United States,Cobb Creek geothermal plant,12,,Geysers geothermal plant U12,110,dry steam,operating,,,1979,,Geysers Power Co LLC,,Calpine CORP [100%],,,,38.777,-122.745,exact,,Sonoma County,,California,Northern America,Americas,"EIA: 286, World Resources Institute: USA0000286",,L100000700033,G100000700051,https://gem.wiki/Cobb_Creek_geothermal_plant
13.3.2024,Ethiopia,Corbetti geothermal power plant,2,,,100,unknown type,pre-construction,,,,,Corbetti Geothermal,,Berkeley Energy [33%]; Reykjavik Geothermal [33%]; InfraCo Africa [33%],,,,7.1819,38.4371,approximate,,,Shashamane,Oromiya,Sub-Saharan Africa,Africa,,,L100000700034,G100000700053,https://gem.wiki/Corbetti_geothermal_power_plant
13.3.2024,Ethiopia,Corbetti geothermal power plant,1,,,50,unknown type,pre-construction,,,2027,,Corbetti Geothermal,,Berkeley Energy [33%]; Reykjavik Geothermal [33%]; InfraCo Africa [33%],,,,7.1819,38.4371,approximate,,,Shashamane,Oromiya,Sub-Saharan Africa,Africa,,,L100000700034,G100000700052,https://gem.wiki/Corbetti_geothermal_power_plant
3.5.2023,United States,Coso BLM geothermal plant,GEN1-3,,,90,flash steam - double,operating,,,1987,,Coso Operating Co LLC,,Atlantica Sustainable Infrastructure [100%],,,,36.0372,-117.7981,exact,,Inyo County,,California,Northern America,Americas,"World Resources Institute: USA0010875, EIA: 10873",,L100000700035,G100000700054,https://gem.wiki/Coso_BLM_geothermal_plant
15.5.2023,United States,Crump Geyser geothermal plant,--,,,30,unknown type,cancelled - inferred 4 y,,,,,,,Ormat Technology INC [50%]; Nevada Geothermal Power CO [50%],,,,42.1774,-119.8986,approximate,Adel,,,Oregon,Northern America,Americas,,,L100000700036,G100000700055,https://gem.wiki/Crump_Geyser_geothermal_plant
14.3.2024,United States,D-J Basin geothermal power plant,Future units,,,395,unknown type,announced,,,,,Geothermal Technologies INC,,,,,,40.5953,-104.6008,approximate,,Weld County,,Colorado,Northern America,Americas,,,L100000700261,G100000700475,https://gem.wiki/D-J_Basin_geothermal_power_plant
1.4.2024,Philippines,Daklan geothermal power plant,--,,,51,,announced,,,,,,,Philippine Geothermal Production Company Inc,,"Three of PGPC's projects are expected to create a total of 1,500 jobs for Filipino workers during exploration, development, well drilling, and commercial operations.",,16.5815472,120.722618,approximate,Abiang,Atok,Benguet,,South-eastern Asia,Asia,"World Resources Institute: WRI1000750, World Resources Institute: WRI1000751",,L100001004542,G100001005329,https://www.gem.wiki/Daklan_geothermal_power_plant
8.5.2023,Indonesia,Darajat geothermal power plant,3,,,121,unknown type,operating,,,2009,,Star Energy Geothermal,,Star Energy Geothermal [100%],,,,-7.2173,107.7394,exact,Padaawas,Pasirwangi,Garut Regency,West Java,South-eastern Asia,Asia,"World Resources Institute: WRI1000750, World Resources Institute: WRI1000751",,L100000700037,G100000700058,https://gem.wiki/Darajat_geothermal_power_plant
